{
  "contractVersion": 2,
  "generatedAt": "2026-10-01T17:05:12+02:00",
  "engineVersion": "0.1.0",
  "logbook": {
    "path": "/home/user/Seldon",
    "language": "de",
    "machine": "workstation-7f3a",
    "git": {
      "head": "a1b2c3d",
      "dirty": false,
      "autocommit": {
        "ok": true,
        "at": "2026-10-01T17:00:01+02:00",
        "message": "seldon: note C-2026-004"
      }
    }
  },
  "state": {
    "status": "ok",
    "lastCapture": "2026-10-01T17:05:00+02:00",
    "collectors": [
      {
        "name": "pacman",
        "enabled": true,
        "ok": true,
        "lastRun": "2026-10-01T17:05:00+02:00"
      },
      {
        "name": "snapper",
        "enabled": true,
        "ok": true,
        "lastRun": "2026-10-01T17:05:00+02:00"
      },
      {
        "name": "omarchy",
        "enabled": true,
        "ok": true,
        "lastRun": "2026-10-01T17:05:00+02:00"
      },
      {
        "name": "plugins",
        "enabled": true,
        "ok": true,
        "lastRun": "2026-10-01T17:05:00+02:00"
      },
      {
        "name": "theme",
        "enabled": true,
        "ok": true,
        "lastRun": "2026-10-01T17:05:00+02:00"
      },
      {
        "name": "config",
        "enabled": true,
        "ok": true,
        "lastRun": "2026-10-01T17:05:00+02:00"
      }
    ]
  },
  "summary": {
    "activeCases": 2,
    "queuedCases": 3,
    "openDrift": 250,
    "crisis": 2,
    "eventsToday": 32,
    "events7d": 53
  },
  "today": {
    "date": "2026-10-01",
    "path": "journal/2026/2026-10-01.md",
    "entries": [
      {
        "time": "09:25",
        "actor": "agent:claude-code",
        "case": "C-2026-003",
        "text": "`omarchy update` durchgelaufen (4.0.6-1 → 4.0.7-1), Snapshot 112 vorher. Hyprland 0.53 läuft. Offen: Release-Notes gegen die eigenen Bindings abgleichen."
      },
      {
        "time": "10:40",
        "actor": "agent:claude-code",
        "case": "C-2026-004",
        "text": "Zed installiert, Keybindings nach Omarchy-Defaults gesetzt. Gelernt: `omarchy pkg add` statt yay, dann landet es sauber im Ledger."
      },
      {
        "time": "14:40",
        "actor": "human",
        "case": null,
        "text": "Codex hat ollama ohne Case installiert, samt User-Service. Snapshot 113 gemacht; morgen entscheiden, ob es bleibt (Vorschlag ADR-0004)."
      },
      {
        "time": "17:00",
        "actor": "human",
        "case": "C-2026-004",
        "text": "Zed fühlt sich gut an. Theme-Sync fehlt noch, siehe Inbox."
      }
    ],
    "yesterday": [
      {
        "time": "19:10",
        "actor": "human",
        "case": null,
        "text": "Snapshots aufgeräumt, 108 und 109 gelöscht."
      }
    ]
  },
  "events": [
    {
      "id": "01M3VZNFC0M2FQVGJBZGX9KDF7",
      "ts": "2026-10-01T17:00:00+02:00",
      "source": "manual",
      "kind": "note",
      "subject": "C-2026-004",
      "detail": "Zed fühlt sich gut an. Theme-Sync fehlt noch, siehe Inbox.",
      "actor": "human",
      "case": "C-2026-004"
    },
    {
      "id": "01M3VXYNF0XTBDWFTZP1412REN",
      "ts": "2026-10-01T16:30:04+02:00",
      "source": "snapper",
      "kind": "snapshot",
      "subject": "115",
      "detail": "tailscale: MagicDNS",
      "actor": "system",
      "meta": {
        "type": "post",
        "cleanup": "",
        "pairOf": 114
      }
    },
    {
      "id": "01M3VXYHJ0CDTAWEV5WRW4C0C2",
      "ts": "2026-10-01T16:30:00+02:00",
      "source": "snapper",
      "kind": "snapshot",
      "subject": "114",
      "detail": "tailscale: MagicDNS",
      "actor": "system",
      "meta": {
        "type": "pre",
        "cleanup": ""
      }
    },
    {
      "id": "01M3VWSXP0SCPF5TBS4PCB12ZC",
      "ts": "2026-10-01T16:10:00+02:00",
      "source": "plugins",
      "kind": "plugin-add",
      "subject": "io.github.example.tyme",
      "detail": "1.1.0",
      "actor": "system",
      "zone": "yellow",
      "resolution": "explained",
      "resolutionDetail": "Zeiterfassung nur zum Testen, noch nicht in der Bar.",
      "meta": {
        "version": "1.1.0",
        "enabled": false
      }
    },
    {
      "id": "01M3VTGNY0NZG4AY80814WSKGR",
      "ts": "2026-10-01T15:30:00+02:00",
      "source": "theme",
      "kind": "theme-set",
      "subject": "tokyo-night",
      "detail": "kanagawa → tokyo-night",
      "actor": "human",
      "zone": "yellow",
      "meta": {
        "from": "kanagawa",
        "to": "tokyo-night"
      }
    },
    {
      "id": "01M3VQN4807PWS1QE2RYRV2E4E",
      "ts": "2026-10-01T14:40:00+02:00",
      "source": "manual",
      "kind": "note",
      "subject": "journal",
      "detail": "Codex hat ollama ohne Case installiert, samt User-Service. Snapshot 113 gemacht; morgen entscheiden, ob es bleibt (Vorschlag ADR-0004).",
      "actor": "human"
    },
    {
      "id": "01M3VQ2TA0HFEWFW5PT72E64FK",
      "ts": "2026-10-01T14:30:00+02:00",
      "source": "snapper",
      "kind": "snapshot",
      "subject": "113",
      "detail": "pre: ollama",
      "actor": "system",
      "meta": {
        "type": "single",
        "cleanup": ""
      }
    },
    {
      "id": "01M3VNJ9JGZ9169T01XCW16FT0",
      "ts": "2026-10-01T14:03:30+02:00",
      "source": "config",
      "kind": "config-add",
      "subject": "~/.config/systemd/user/ollama.service",
      "detail": "sha256 — → c0243ca5",
      "actor": "agent:codex",
      "zone": "red",
      "meta": {
        "hashTo": "c0243ca5c3421df489cb0d4a060f3f4c47490a2a9752c20ce5f6ef84665827bc"
      }
    },
    {
      "id": "01M3VNHD88HSQHSVJ6ZNCXDK1W",
      "ts": "2026-10-01T14:03:01+02:00",
      "source": "agent",
      "kind": "command",
      "subject": "tee",
      "actor": "agent:codex",
      "zone": "red",
      "meta": {
        "command": "tee ~/.config/systemd/user/ollama.service"
      }
    },
    {
      "id": "01M3VNFTF8EVHWFFZ687N14Q0C",
      "ts": "2026-10-01T14:02:09+02:00",
      "source": "pacman",
      "kind": "install",
      "subject": "ollama",
      "detail": "0.6.1-1",
      "actor": "agent:codex",
      "zone": "red",
      "explicit": true,
      "txId": "tx-20261001T140209",
      "meta": {
        "command": "pacman -S --noconfirm ollama",
        "version": "0.6.1-1"
      }
    },
    {
      "id": "01M3VNF5Z06QEBJEEMHS802D2F",
      "ts": "2026-10-01T14:01:48+02:00",
      "source": "agent",
      "kind": "command",
      "subject": "pacman",
      "actor": "agent:codex",
      "zone": "red",
      "meta": {
        "command": "sudo pacman -S --noconfirm ollama"
      }
    },
    {
      "id": "01M3VF44WRRE97RKE4HY66YBV0",
      "ts": "2026-10-01T12:10:55+02:00",
      "source": "seldon",
      "kind": "case-verified",
      "subject": "C-2026-008",
      "actor": "human",
      "case": "C-2026-008"
    },
    {
      "id": "01M3VDBX30F5DH0JNY7S0K95GC",
      "ts": "2026-10-01T11:40:12+02:00",
      "source": "pacman",
      "kind": "install",
      "subject": "tailscale",
      "detail": "1.102.3-1",
      "actor": "system",
      "case": "C-2026-008",
      "zone": "red",
      "explicit": true,
      "txId": "tx-20261001T114012",
      "resolution": "linked",
      "meta": {
        "command": "pacman -S --noconfirm --needed tailscale",
        "version": "1.102.3-1"
      }
    },
    {
      "id": "01M3VC9Z50ZYXN39KS9VY1T5VJ",
      "ts": "2026-10-01T11:21:40+02:00",
      "source": "seldon",
      "kind": "case-started",
      "subject": "C-2026-008",
      "actor": "human",
      "case": "C-2026-008",
      "meta": {
        "risk": "R2"
      }
    },
    {
      "id": "01M3VC74ARPB23HG486VS0V52M",
      "ts": "2026-10-01T11:20:07+02:00",
      "source": "seldon",
      "kind": "case-created",
      "subject": "C-2026-008",
      "detail": "Tailscale für Fernzugriff einrichten",
      "actor": "human",
      "case": "C-2026-008",
      "meta": {
        "risk": "R2"
      }
    },
    {
      "id": "01M3VB2V6G1EE4HHZ9SB8SRKMS",
      "ts": "2026-10-01T11:00:18+02:00",
      "source": "seldon",
      "kind": "case-created",
      "subject": "C-2026-007",
      "detail": "Herdr-Orchestrator als Default-Agent registrieren",
      "actor": "human",
      "case": "C-2026-007",
      "meta": {
        "risk": "R1"
      }
    },
    {
      "id": "01M3V9XQPG3XSQHDE1KSNTZRQA",
      "ts": "2026-10-01T10:40:02+02:00",
      "source": "config",
      "kind": "config-change",
      "subject": "~/.config/hypr/bindings.conf",
      "detail": "sha256 3b385861 → 09688c64",
      "actor": "agent:claude-code",
      "case": "C-2026-004",
      "zone": "yellow",
      "meta": {
        "hashFrom": "3b385861a45434b52df011d29bd162931e7669d3401c29a1f0da128c9694d90c",
        "hashTo": "09688c642450e34eccc5ca90f344b9165a92dce56a26945306987fe927acf33f"
      }
    },
    {
      "id": "01M3V9W9SRGN5446Q2PXBRP7VK",
      "ts": "2026-10-01T10:39:15+02:00",
      "source": "agent",
      "kind": "command",
      "subject": "sed",
      "actor": "agent:claude-code",
      "case": "C-2026-004",
      "zone": "yellow",
      "meta": {
        "command": "sed -i 's/^bindd = SUPER, E, Editor, exec, .*/bindd = SUPER, E, Editor, exec, zeditor/' ~/.config/hypr/bindings.conf"
      }
    },
    {
      "id": "01M3V9VHCGTNRG2J62SMNR51TG",
      "ts": "2026-10-01T10:38:50+02:00",
      "source": "agent",
      "kind": "command",
      "subject": "tee",
      "actor": "agent:claude-code",
      "case": "C-2026-004",
      "zone": "green",
      "meta": {
        "command": "tee ~/.config/zed/settings.json"
      }
    },
    {
      "id": "01M3V8AJ08NT7N105393XZXCP7",
      "ts": "2026-10-01T10:12:05+02:00",
      "source": "pacman",
      "kind": "install",
      "subject": "zed",
      "detail": "0.198.4-1",
      "actor": "agent:claude-code",
      "case": "C-2026-004",
      "zone": "red",
      "explicit": true,
      "txId": "tx-20261001T101204",
      "meta": {
        "command": "pacman -S --needed --noconfirm --config /etc/pacman.conf -- extra/zed",